{
  "id": "bounded-improvement",
  "sourcePaths": [
    "skills/poteto-mode/playbooks/hillclimb.md",
    "skills/poteto-mode/SKILL.md",
    "skills/how/SKILL.md",
    "skills/how/references/explorer-prompt.md",
    "skills/how/references/explainer-prompt.md",
    "skills/benchmark-checklist/SKILL.md",
    "skills/principle-explain-the-number/SKILL.md",
    "skills/show-me-your-work/SKILL.md",
    "skills/show-me-your-work/scripts/log.sh",
    "skills/show-me-your-work/references/decision-log-template.tsv",
    "skills/principle-prove-it-works/SKILL.md",
    "skills/principle-build-the-lever/SKILL.md",
    "skills/principle-guard-the-context-window/SKILL.md",
    "skills/principle-separate-before-serializing-shared-state/SKILL.md",
    "skills/principle-sequence-verifiable-units/SKILL.md",
    "skills/principle-laziness-protocol/SKILL.md",
    "skills/poteto-mode/playbooks/perf-issue.md",
    "skills/poteto-mode/playbooks/autonomous-run.md",
    "skills/poteto-mode/playbooks/opening-a-pr.md",
    "agents/poteto-agent.md"
  ],
  "prompt": "Hillclimb a fixture export latency using a fixed target and minimum iteration count. Supply contrasting realistic workloads, an exact baseline revision, a repeatable harness, error and completed-work counts, a green regression gate and candidate artifacts. Include an early lucky win, noise-sized improvement, changed workload, regression, plateau, worthwhile cheap remaining hypothesis and exhausted marginal ideas. Permit local measurement and edits but no commits, PR writes or recurring scheduling. Repeat with unavailable workers, denied execution and missing persistence. Compare every candidate using the same valid frozen metric and retain the stopping rule.",
  "requirements": [
    "Read the complete mode, playbook, how prompts, measurement and principle leaves, poteto role prompt and decision-log helper. Missing required reads stop dependent work.",
    "Reproduce the complaint across realistic workload dimensions. Agree one metric, direction, target and minimum attempt floor before attempts. Prove harness sensitivity with contrasting workloads, vet the checklist, freeze command/configuration, record baseline and green gate.",
    "Use exact revisions and comparable workloads. For performance comparisons alternate at least five runs per side, retain median/range, limiter, production tuning, outputs, error and completed-work counts. Source inspection and inconclusive comparisons cannot prove gains.",
    "Open gitignored decision.tsv through show-me-your-work and log.sh. Preserve append-only history, per-attempt id/hypothesis/change/before/after/delta/tests/verdict/note, read before attempts, readback persistence and transcript/review limits.",
    "Ground hypotheses in how. For performance use Perf issue mantra order without its earlier-success stop rule. Delegate tightly scoped revision-matched attempts with full role prompt, supported configured or inherited selection and inspected results. Isolate concurrent hypotheses and compare each to the same base; sequential fallback stays reduced.",
    "Measure and gate each single change before the next. Keep only changes past noise with green tests, revert failed candidates fully without touching unrelated work, and log every verdict. Commit each accepted fix only with permission and exact staging.",
    "Pivot after a plateau, combine near-misses only as a newly verified single hypothesis, prioritize correctness/simplicity, and do not abandon cheap remaining ideas. Stop at target plus floor, marginal cost or a surfaced dead end without relaxing the predicate. Wake scheduling borrows only Autonomous run mechanism and requires explicit authorization.",
    "Deliver accepted commits in order through complete Opening a PR only when authorized. Return metric/target, baseline/final/calculated percent, kept/reverted counts, each accepted fix, decision.tsv path and next idea, plus stop reason and Attention/review limits."
  ],
  "expectedFull": "Observed authorized independent candidates use the same sensitive frozen metric, comparable exact revisions/workloads and green regression gate. Every attempt has inspected evidence and an append-only log row. Regressions and noise-sized changes revert. A lucky win below the agreed iteration floor does not stop the loop, a plateau prompts new hypotheses, and cheap untried ideas remain actionable. The loop ends at the unchanged predicate or explicitly reports a marginal-cost stop or genuine dead end. Authorized commits and delivery preserve accepted order. The reply contains every original item and real artifacts.",
  "expectedReduced": "Authorized sequential attempts preserve the same measurement and stopping gates but leave independent delegation unsatisfied. No commit or external-write permission retains verified local work and a local PR draft only. No wake authorization means foreground execution. Supplied artifacts can support a limited assessment but cannot create missing runs. Unknown models, unavailable transcript audit or different-family review remain explicit limits.",
  "expectedBlocked": "Missing required source or pending companions blocks dependent routes. An unreproduced complaint requires repro repair before hillclimbing. An insensitive harness, missing green baseline, denied measurement execution, changed metric/workload, unchecked errors/work or missing artifacts prevents accepting a candidate. Missing persistence/helper execution blocks the required saved decision trail. An unavailable required model or independent-review capability stays blocked. Unavailable checks stop advancement; unauthorized commits, scheduling and external writes remain unperformed.",
  "forbiddenClaims": [
    "Structural validation proves a measured improvement or a host pass.",
    "A lucky early win meets the stopping predicate without the minimum attempts, or the target can be relaxed to claim success.",
    "Perf issue or Autonomous run stop rules replace Hillclimb stopping rules.",
    "A changed metric, workload or unrecorded revision is comparable, or noise-sized gains and regressions are kept.",
    "An insensitive harness, untuned run, unknown limiter or skipped work proves a win.",
    "Sequential attempts are independent workers or unknown requested models prove diversity.",
    "An unavailable helper ran, an unsaved log persisted, or missing transcript/reviewer access proves a complete audit.",
    "Upstream autonomy authorizes commits, scheduling, PR writes or installation.",
    "A local draft is a created PR, unrun tests are green, or opening a PR starts Babysit.",
    "A cost-based stop meets the target or a zero baseline supports a percent improvement."
  ]
}
