[
  {
    "expectedBlocked": "Workers are required and unavailable; record blocked without launching invented operations.",
    "expectedFull": "A discovered spawn operation and result inspection support independent workers after capability becomes available.",
    "expectedReduced": "Complete authorized sequential work and label it reduced-pass; report absent workers.",
    "forbiddenClaims": [
      "Case definition or fixture test proves host support.",
      "Independent workers without a successful exposed spawn operation.",
      "Full pass for sequential fallback.",
      "Retry external action without permission and prior action inspection."
    ],
    "id": "absent-workers",
    "prompt": "No independent worker operation is available.",
    "requirements": [
      "Record unavailable workers; use authorized sequential work only.",
      "Capture exact input revision, explicit permissions and observed operation evidence."
    ],
    "sourcePaths": [
      "agents/poteto-agent.md",
      "skills/poteto-mode/SKILL.md",
      "skills/poteto-mode/playbooks/orchestrate.md"
    ]
  },
  {
    "expectedBlocked": "Write permission is denied; stop dependent output and integration.",
    "expectedFull": "Observed permission grants and isolated write/readback support the assigned output.",
    "expectedReduced": "Return authorized read-only findings with denied writes recorded as a limit.",
    "forbiddenClaims": [
      "Case definition or fixture test proves host support.",
      "Independent workers without a successful exposed spawn operation.",
      "Full pass for sequential fallback.",
      "Retry external action without permission and prior action inspection."
    ],
    "id": "denied-writes",
    "prompt": "A host denies the assigned isolated write.",
    "requirements": [
      "Preserve the denial and stop dependent writes.",
      "Capture exact input revision, explicit permissions and observed operation evidence."
    ],
    "sourcePaths": [
      "agents/poteto-agent.md",
      "skills/poteto-mode/SKILL.md",
      "skills/poteto-mode/playbooks/orchestrate.md"
    ]
  },
  {
    "expectedBlocked": "Overlapping ownership remains unresolved; neither worker writes the contested path.",
    "expectedFull": "Coordinator resolves ownership into distinct paths before observed workers write.",
    "expectedReduced": "One authorized sequential writer produces output; worker independence is unclaimed.",
    "forbiddenClaims": [
      "Case definition or fixture test proves host support.",
      "Independent workers without a successful exposed spawn operation.",
      "Full pass for sequential fallback.",
      "Retry external action without permission and prior action inspection."
    ],
    "id": "shared-path-conflict",
    "prompt": "Two workers request the same output path.",
    "requirements": [
      "Coordinator assigns distinct paths before either writes.",
      "Capture exact input revision, explicit permissions and observed operation evidence."
    ],
    "sourcePaths": [
      "agents/poteto-agent.md",
      "skills/poteto-mode/SKILL.md",
      "skills/poteto-mode/playbooks/orchestrate.md"
    ]
  },
  {
    "expectedBlocked": "Cancellation outcome or artifact ownership cannot be established; block integration.",
    "expectedFull": "Observe stop and terminal cancellation; quarantine partial output and integrate only a separately reviewed completed assignment.",
    "expectedReduced": "Unavailable stop operation permits only local artifact inspection; record unconfirmed termination.",
    "forbiddenClaims": [
      "Case definition or fixture test proves host support.",
      "Independent workers without a successful exposed spawn operation.",
      "Full pass for sequential fallback.",
      "Retry external action without permission and prior action inspection."
    ],
    "id": "cancelled-worker",
    "prompt": "A worker is cancelled after producing a partial artifact.",
    "requirements": [
      "Stop and quarantine partial output; inspect before integration.",
      "Capture exact input revision, explicit permissions and observed operation evidence."
    ],
    "sourcePaths": [
      "agents/poteto-agent.md",
      "skills/poteto-mode/SKILL.md",
      "skills/poteto-mode/playbooks/orchestrate.md"
    ]
  },
  {
    "expectedBlocked": "Outcome or permission is unknown; block replay until inspection and authorization are available.",
    "expectedFull": "Inspect prior action identity and destination outcome; use explicitly authorized idempotent recovery without duplicate action.",
    "expectedReduced": "Produce a local handoff describing the unknown external outcome; claim no completed external write.",
    "forbiddenClaims": [
      "Case definition or fixture test proves host support.",
      "Independent workers without a successful exposed spawn operation.",
      "Full pass for sequential fallback.",
      "Retry external action without permission and prior action inspection."
    ],
    "id": "interrupted-external-write",
    "prompt": "An authorized external write is interrupted after dispatch.",
    "requirements": [
      "Inspect prior action identity and remote result before any retry.",
      "Capture exact input revision, explicit permissions and observed operation evidence."
    ],
    "sourcePaths": [
      "agents/poteto-agent.md",
      "skills/poteto-mode/SKILL.md",
      "skills/poteto-mode/playbooks/orchestrate.md"
    ]
  },
  {
    "expectedBlocked": "Required durable state is unavailable and no authorized handoff exists; block continuation.",
    "expectedFull": "Observe durable write/readback after persistence becomes available; link assignment history.",
    "expectedReduced": "Deliver an authorized local handoff and record unavailable cross-session persistence.",
    "forbiddenClaims": [
      "Case definition or fixture test proves host support.",
      "Independent workers without a successful exposed spawn operation.",
      "Full pass for sequential fallback.",
      "Retry external action without permission and prior action inspection."
    ],
    "id": "unavailable-persistence",
    "prompt": "Durable session persistence is unavailable.",
    "requirements": [
      "Declare unavailable persistence and provide an authorized local handoff if possible.",
      "Capture exact input revision, explicit permissions and observed operation evidence."
    ],
    "sourcePaths": [
      "agents/poteto-agent.md",
      "skills/poteto-mode/SKILL.md",
      "skills/poteto-mode/playbooks/orchestrate.md"
    ]
  }
]
